{
  "version": 1,
  "license": "CC-BY-SA-3.0",
  "copyright": "MetaFlud",
  "size": {
    "x": 32,
    "y": 32
  },
  "states": [
    {
      "name": "icon"
    },
    {
      "name": "equipped-OUTERCLOTHING",
      "directions": 4
    },
    {
      "name": "inhand-left",
      "directions": 4
    },
    {
      "name": "inhand-right",
      "directions": 4
    }
  ]
}
