{
    "version": 1,
    "license": "EULA/CLA with a hosting restriction, full text: https://raw.githubusercontent.com/SerbiaStrong-220/space-station-14/master/CLA.txt",
    "copyright": "Sprited by matriotic (Discord) for SS220",
    "size": {
        "x": 32,
        "y": 32
    },
    "states": [
        {
            "name": "icon"
        },
        {
            "name": "bolt-open"
        },
        {
            "name": "inhand-left",
            "directions": 4
        },
        {
            "name": "inhand-right",
            "directions": 4
        },
        {
            "name": "equipped-BELT",
            "directions": 4
        }
    ]
}
