{
    "version": 1,
    "license": "EULA/CLA with a hosting restriction, full text: https://raw.githubusercontent.com/SerbiaStrong-220/space-station-14/master/CLA.txt",
    "copyright": "Sprited by Gabka for SS220",
    "size": {
        "x": 32,
        "y": 32
    },
    "states": [
        {
            "name": "icon"
        },
        {
            "name": "equipped-OUTERCLOTHING",
            "directions": 4
        }
    ]
}
