{
  "version": 1,
  "license": "CC-BY-SA-3.0",
  "copyright": "MadSkaven",
  "size": {
    "x": 32,
    "y": 32
  },
    "states": [
        {
            "name": "computer",
            "directions": 4
        },
        {
            "name": "generic_keyboard",
            "directions": 4
        },
        {
            "name": "generic_keys",
            "directions": 4,
            "delays": [
                [
                    0.2,
                    0.2,
                    0.2
                ],
                [
                    0.2,
                    0.2,
                    0.2
                ],
                [
                    0.2,
                    0.2,
                    0.2
                ],
                [
                    0.2,
                    0.2,
                    0.2
                ]
            ]
        },
        {
            "name": "generic",
            "directions": 4,
            "delays": [
                [
                    0.2,
                    0.2,
                    0.2,
                    0.2,
                    0.2
                ],
                [
                    0.2,
                    0.2,
                    0.2,
                    0.2,
                    0.2
                ],
                [
                    0.2,
                    0.2,
                    0.2,
                    0.2,
                    0.2
                ],
                [
                    0.2,
                    0.2,
                    0.2,
                    0.2,
                    0.2
                ]
            ]
        }
    ]
}
