{
    "version": 1,
    "license": "CC-BY-SA-3.0",
    "copyright": "Taken/modified by Taral from tgstation at commit https://github.com/tgstation/tgstation/commit/dbc2435fa562f4ef130a7112d2a4cc9c80099894. Vox states by Flareguy for Space Station 14. Resprited by Estkemran (Github) for SS220. Resomi states sprited by abubben (Discord) for ss220",
    "size": {
        "x": 32,
        "y": 32
    },
    "states": [
        {
            "name": "icon"
        },
        {
            "name": "equipped-OUTERCLOTHING",
            "directions": 4
        },
        {
            "name": "equipped-OUTERCLOTHING-resomi",
            "directions": 4
        },
        {
            "name": "equipped-OUTERCLOTHING-vox",
            "directions": 4
        },
        {
            "name": "inhand-left",
            "directions": 4
        },
        {
            "name": "inhand-right",
            "directions": 4
        }
    ]
}
