{
  "version": 1,
  "license": "EULA/CLA with a hosting restriction, full text: https://raw.githubusercontent.com/SerbiaStrong-220/space-station-14/master/CLA.txt",
  "copyright": "Sprited by Estkemran (Github) modified by kimorue (Discord) for SS220",
  "size": {
    "x": 32,
    "y": 32
  },
  "states": [
    {
      "name": "tarantula_spawn"
    },
    {
      "name": "web_spawn"
    },
    {
      "name": "wall_spawn"
    },
    {
      "name": "prying"
    },
    {
      "name": "cocoon"
    }
  ]
}
