{
  "version": 1,
  "license": "EULA/CLA with a hosting restriction, full text: https://raw.githubusercontent.com/SerbiaStrong-220/space-station-14/master/CLA.txt",
  "copyright": "Made by gabova (Discord) for SS220",
  "size": {
    "x": 32,
    "y": 32
  },
  "states": [
    {
      "name": "bagpile1"
    },
    {
      "name": "bagpile2"
    },
    {
      "name": "bagpile3"
    },
    {
      "name": "bagpile4"
    },
    {
      "name": "bagpile5"
    },
    {
      "name": "bagpile6"
    },
    {
      "name": "bagpile7"
    },
    {
      "name": "bagpile8"
    },
    {
      "name": "bagpile9"
    }
  ]
}