{
    "version": 1,
    "license": "EULA/CLA with a hosting restriction, full text: https://raw.githubusercontent.com/SerbiaStrong-220/space-station-14/master/CLA.txt",
    "copyright": "Made by Mixnikita for SS220",
    "size": {
        "x": 32,
        "y": 32
    },
    "states": [
        {
            "name": "cleansingEffect",
            "delays": [
                [
                    0.15,
                    0.15,
                    0.15,
                    0.15,
                    0.15,
                    0.15,
                    0.15,
                    0.15,
                    0.15,
                    0.15,
                    0.15,
                    0.15,
                    0.15,
                    0.15,
                    0.15,
                    0.15
                ]
            ]
        }
    ]
}
