{
  "version": 1,
  "license": "CC-BY-SA-3.0",
  "copyright": "Taken from tgstation at commit https://github.com/tgstation/tgstation/commit/5a73e8f825ff279e82949b9329783a9e3070e2da, sprites in hand by PuroSlavKing (Github) and RudeyCoolLeet#3875, colors edited by noctyrnal (github) modified by MrALPAKA for SS220, colors edited by EstKemran (Github) for SS220, resomi states sprited by abubben (Discord) for SS220",
  "size": {
    "x": 32,
    "y": 32
  },
  "states": [
    {
      "name": "icon"
    },
    {
      "name": "equipped-NECK",
      "directions": 4
    },
	  {
      "name": "equipped-NECK-resomi",
      "directions": 4
    },
    {
      "name": "inhand-left",
      "directions": 4
    },
    {
      "name": "inhand-right",
      "directions": 4
    }
  ]
}
