{
  "version": 1,
  "license": "CC-BY-SA-3.0",
  "copyright": "Taken from TG Station https://github.com/tgstation/tgstation/blob/HEAD/icons/mob/clothing/modsuit/mod_clothing.dmi, vox state taken from Skyrat TG Station https://github.com/Skyrat-SS13/Skyrat-tg/blob/HEAD/modular_skyrat/modules/better_vox/icons/clothing/mod.dmi",
  "size": {
    "x": 32,
    "y": 32
  },
  "states": [
    {
      "name": "icon"
    },
    {
      "name": "icon-flash"
    },
    {
      "name": "off-equipped-HELMET",
      "directions": 4
    },
    {
      "name": "off-equipped-HELMET-vox",
      "directions": 4
    },
    {
      "name": "on-equipped-HELMET",
      "directions": 4
    },
    {
      "name": "on-equipped-HELMET-vox",
      "directions": 4
    },
    {
      "name": "off-inhand-left",
      "directions": 4
    },
    {
      "name": "off-inhand-right",
      "directions": 4
    }
  ]
}
