{
  "version": 1,
  "license": "CC-BY-SA-3.0",
  "copyright": "By okroshka14",
  "size": {
    "x": 32,
    "y": 32
  },
  "states": [
      {
      "name": "equipped-MASK",
      "directions": 4,
      "delays": [
        [
          0.1,
          0.1,
          0.1,
          0.1,
          0.1,
          0.1,
          0.1,
          0.1
        ],
        [
          0.1,
          0.1,
          0.1,
          0.1,
          0.1,
          0.1,
          0.1,
          0.1
        ],
        [
          0.1,
          0.1,
          0.1,
          0.1,
          0.1,
          0.1,
          0.1,
          0.1
        ],
        [
          0.1,
          0.1,
          0.1,
          0.1,
          0.1,
          0.1,
          0.1,
          0.1
        ]
      ]
    },
    {
    "name": "icon",
    "delays": [
        [
          0.1,
          0.1,
          0.1,
          0.1,
          0.1,
          0.1
        ]
      ]
    },
    {
      "name": "inhand-left",
      "directions": 4,
      "delays": [
        [
          0.1,
          0.1,
          0.1,
          0.1,
          0.1,
          0.1,
          0.1,
          0.1
        ],
        [
          0.1,
          0.1,
          0.1,
          0.1,
          0.1,
          0.1,
          0.1,
          0.1
        ],
        [
          0.1,
          0.1,
          0.1,
          0.1,
          0.1,
          0.1,
          0.1,
          0.1
        ],
        [
          0.1,
          0.1,
          0.1,
          0.1,
          0.1,
          0.1,
          0.1,
          0.1
        ]
      ]
    },
    {
      "name": "inhand-right",
      "directions": 4,
      "delays": [
        [
          0.1,
          0.1,
          0.1,
          0.1,
          0.1,
          0.1,
          0.1,
          0.1
        ],
        [
          0.1,
          0.1,
          0.1,
          0.1,
          0.1,
          0.1,
          0.1,
          0.1
        ],
        [
          0.1,
          0.1,
          0.1,
          0.1,
          0.1,
          0.1,
          0.1,
          0.1
        ],
        [
          0.1,
          0.1,
          0.1,
          0.1,
          0.1,
          0.1,
          0.1,
          0.1
        ]
      ]
    }
]
}
