{
  "version": 1,
  "license": "CC-BY-SA-3.0",
  "copyright": "By Aserovich, modified by Estkemran (Github) for SS220",
  "size": {
    "x": 32,
    "y": 32
  },
  "states": [
    {
      "name": "iaa_card"
    },
    {
      "name": "law_card"
    },
    {
      "name": "magistrate_card"
    }
  ]
}
