{
  "version": 1,
  "license": "EULA/CLA with a hosting restriction, full text: https://raw.githubusercontent.com/SerbiaStrong-220/space-station-14/master/CLA.txt",
  "copyright": "Made by mixnikita (Discord) for SS220, resomi states sprited by abubben (Discord) for SS220",
  "size": {
    "x": 32,
    "y": 32
  },
  "states": [
    {
      "name": "icon"
    },
    {
      "name": "equipped-OUTERCLOTHING",
      "directions": 4
    },
    {
      "name": "equipped-OUTERCLOTHING-resomi",
      "directions": 4
    },
    {
      "name": "inhand-left",
      "directions": 4
    },
    {
      "name": "inhand-right",
      "directions": 4
    }
  ]
}
