{
  "version": 1,
  "license": "CC-BY-SA-3.0",
  "copyright": "Made by PorteRianes, https://github.com/PorteRianes",
  "size": {
    "x": 64,
    "y": 64
  },
  "states": [
    {
        "name": "basicloader",
        "directions": 4
    },
    {
        "name": "basicloadercolor",
        "directions": 4
    }
  ]
}
