{
  "version": 1,
  "license": "CC0-1.0",
  "copyright": "Original base by deltanedas (github) for SS14. Resprited by (DISCORD)@ps3moira#9488. Resprited by KREKS. Resprited by TonyBigShoes (Github) for SS220",
  "size": {
    "x": 32,
    "y": 32
  },
  "states": [
    {
      "name": "icon"
    },
    {
      "name": "low"
    },
    {
      "name": "medium"
    },
    {
      "name": "high"
    }
  ]
}
