{
    "version": 1,
    "license": "CC-BY-SA-3.0",
    "copyright": "Made by JustSmartgun",
    "size": {
        "x": 32,
        "y": 32
    },
    "states": [
        {
            "name": "hydraulic_clamp"
        },
        {
            "name": "hydraulic_piston"
        },
        {
            "name": "hydraulic_piston_black"
        },
        {
            "name": "hydraulic_pump"
        },
        {
            "name": "large_psu"
        },
        {
            "name": "psu"
        }
    ]
}
